Publication Type,Authors,Book Authors,Book Editors,Book Group Authors,Author Full Names,Book Author Full Names,Group Authors,Article Title,Source Title,Book Series Title,Book Series Subtitle,Language,Document Type,Conference Title,Conference Date,Conference Location,Conference Sponsor,Conference Host,Author Keywords,Keywords Plus,Abstract,Addresses,Affiliations,Reprint Addresses,Email Addresses,Researcher Ids,ORCIDs,Funding Orgs,Funding Name Preferred,Funding Text,Cited References,Cited Reference Count,"Times Cited, WoS Core","Times Cited, All Databases",180 Day Usage Count,Since 2013 Usage Count,Publisher,Publisher City,Publisher Address,ISSN,eISSN,ISBN,Journal Abbreviation,Journal ISO Abbreviation,Publication Date,Publication Year,Volume,Issue,Part Number,Supplement,Special Issue,Meeting Abstract,Start Page,End Page,Article Number,DOI,DOI Link,Book DOI,Early Access Date,Number of Pages,WoS Categories,Web of Science Index,Research Areas,IDS Number,Pubmed Id,Open Access Designations,Highly Cited Status,Hot Paper Status,Date of Export,UT (Unique WOS ID),Web of Science Record
J,"Eddy, TD; Lam, VWY; Reygondeau, G; Cisneros-Montemayor, AM; Greer, K; Palomares, MLD; Bruno, JF; Ota, Y; Cheung, WWL",,,,"Eddy, Tyler D.; Lam, Vicky W. Y.; Reygondeau, Gabriel; Cisneros-Montemayor, Andres M.; Greer, Krista; Palomares, Maria Lourdes D.; Bruno, John F.; Ota, Yoshitaka; Cheung, William W. L.",,,Global decline in capacity of coral reefs to provide ecosystem services,ONE EARTH,,,English,Article,,,,,,,MARINE PROTECTED AREAS; CLIMATE-CHANGE; FISHERIES; DRIVEN; CONSERVATION; EXPANSION; IMPACTS; FISH,"Coral reefs worldwide are facing impacts from climate change, overfishing, habitat destruction, and pollution. The cumulative effect of these impacts on global capacity of coral reefs to provide ecosystem services is unknown. Here, we evaluate global changes in extent of coral reef habitat, coral reef fishery catches and effort, Indigenous consumption of coral reef fishes, and coral-reef-associated biodiversity. Global coverage of living coral has declined by half since the 1950s. Catches of coral-reef-associated fishes peaked in 2002 and are in decline despite increasing fishing effort, and catch-per-unit effort has decreased by 60% since 1950. At least 63% of coral-reef-associated biodiversity has declined with loss of coral extent. With projected continued degradation of coral reefs and associated loss of biodiversity and fisheries catches, the well-being and sustainable coastal development of human communities that depend on coral reef ecosystem services are threatened.","[Eddy, Tyler D.; Lam, Vicky W. Y.; Reygondeau, Gabriel; Cisneros-Montemayor, Andres M.; Cheung, William W. L.] Univ British Columbia, Inst Oceans & Fisheries, Nippon Fdn Nereus Program, Vancouver, BC, Canada; [Eddy, Tyler D.] Mem Univ Newfoundland, Fisheries & Marine Inst, Ctr Fisheries Ecosyst Res, St John, NF, Canada; [Cisneros-Montemayor, Andres M.; Ota, Yoshitaka] Univ Washington, Sch Marine & Environm Affairs, Nippon Fdn Ocean Nexus Ctr, Seattle, WA 98195 USA; [Cisneros-Montemayor, Andres M.] Simon Fraser Univ, Sch Resource & Environm Management, Burnaby, BC, Canada; [Greer, Krista; Palomares, Maria Lourdes D.] Univ British Columbia, Inst Oceans & Fisheries, Sea Us, Vancouver, BC, Canada; [Bruno, John F.] Univ North Carolina Chapel Hill, Dept Biol, Chapel Hill, NC USA",University of British Columbia; Memorial University Newfoundland; University of Washington; University of Washington Seattle; Simon Fraser University; University of British Columbia; University of North Carolina; University of North Carolina Chapel Hill; University of North Carolina School of Medicine,"Eddy, TD (corresponding author), Univ British Columbia, Inst Oceans & Fisheries, Nippon Fdn Nereus Program, Vancouver, BC, Canada.;Eddy, TD (corresponding author), Mem Univ Newfoundland, Fisheries & Marine Inst, Ctr Fisheries Ecosyst Res, St John, NF, Canada.",tyler.eddy@mi.mun.ca,"Eddy, Tyler/ABE-7092-2021; Reygondeau, Gabriel/G-1903-2017","Eddy, Tyler/0000-0002-2833-9407; Reygondeau, Gabriel/0000-0001-9074-625X",Nippon Foundation; Ocean Nexus Center; Oak Foundation; David and Lucille Packard Foundation; Marisla Foundation; Minderoo Foundation; Paul M. Angell Family Foundation; MAVA Foundation; Oceana; RARE,Nippon Foundation(Nippon Foundation); Ocean Nexus Center; Oak Foundation; David and Lucille Packard Foundation(The David & Lucile Packard Foundation); Marisla Foundation; Minderoo Foundation; Paul M. Angell Family Foundation; MAVA Foundation; Oceana; RARE,"We acknowledge funding provided by the Nippon Foundation to the Nereus Program and the Ocean Nexus Center, which supported T.D.E., V.W.Y.L., G.R., A.M.C.M., Y.O., and W.W.L.C. M.L.D.P. is a member of Sea Around Us, a research initiative supported by the Oak Foundation, David and Lucille Packard Foundation, Marisla Foundation, Minderoo Foundation, Paul M. An-gell Family Foundation, MAVA Foundation, Oceana, and RARE.",,71,63,63,71,238,CELL PRESS,CAMBRIDGE,"50 HAMPSHIRE ST, FLOOR 5, CAMBRIDGE, MA 02139 USA",2590-3330,2590-3322,,ONE EARTH,One Earth,SEP 17,2021,4,9,,,,,1278,1285,,10.1016/j.oneear.2021.08.016,http://dx.doi.org/10.1016/j.oneear.2021.08.016,,SEP 2021,9,Green & Sustainable Science & Technology; Environmental Sciences; Environmental Studies,Science Citation Index Expanded (SCI-EXPANDED); Social Science Citation Index (SSCI),Science & Technology - Other Topics; Environmental Sciences & Ecology,US8KB,,"hybrid, Green Published",Y,N,2023-06-02,WOS:000697673200016,View Full Record in Web of Science
J,"Shan, YL; Fang, S; Cai, BF; Zhou, Y; Li, D; Feng, KS; Hubacek, K",,,,"Shan, Yuli; Fang, Shuai; Cai, Bofeng; Zhou, Ya; Li, Dong; Feng, Kuishuang; Hubacek, Klaus",,,Chinese cities exhibit varying degrees of decoupling of economic growth and CO2 emissions between 2005 and 2015,ONE EARTH,,,English,Article,,,,,,,ENVIRONMENTAL KUZNETS CURVE; CARBON-DIOXIDE EMISSIONS; DECOMPOSITION ANALYSIS; CITY-LEVEL; ENERGY; MITIGATION; HYPOTHESIS; SHANGHAI; EU,"Cities, contributing more than 75% of global carbon emissions, are at the heart of climate change mitigation. Given cities' heterogeneity, they need specific low-carbon roadmaps instead of one-size-fits-all approaches. Here, we present the most detailed and up-to-date accounts of CO2 emissions for 294 cities in China and examine the extent to which their economic growth was decoupled from emissions. Results show that from 2005 to 2015, only 11% of cities exhibited strong decoupling, whereas 65.6% showed weak decoupling, and 23.4% showed no decoupling. We attribute the economic-emission decoupling in cities to several socioeconomic factors (i.e., structure and size of the economy, emission intensity, and population size) and find that the decline in emission intensity via improvement in production and carbon efficiency (e.g., decarbonizing the energy mix via building a renewable energy system) is the most important one. The experience and status quo of carbon emissions and emission-GDP (gross domestic product) decoupling in Chinese cities may have implications for other developing economies to design low-carbon development pathways.","[Shan, Yuli; Hubacek, Klaus] Univ Groningen, Energy & Sustainabil Res Inst Groningen, Integrated Res Energy Environm & Soc IREES, NL-9747 AG Groningen, Netherlands; [Fang, Shuai] Univ Groningen, Dept Econ Geog, NL-9747 AD Groningen, Netherlands; [Cai, Bofeng] Chinese Acad Environm Planning, Ctr Climate & Environm Policy, Beijing 100012, Peoples R China; [Zhou, Ya] Guangdong Univ Technol, Inst Environm & Ecol Engn, Key Lab City Cluster Environm Safety & Green Dev, Minist Educ, Guangzhou 510006, Peoples R China; [Li, Dong] Beijing Tsinghua Tongheng Urban Planning & Design, Innovat Ctr Technol, Beijing, Peoples R China; [Feng, Kuishuang] Univ Maryland, Dept Geog Sci, College Pk, MD 20742 USA",University of Groningen; University of Groningen; Guangdong University of Technology; University System of Maryland; University of Maryland College Park,"Shan, YL; Hubacek, K (corresponding author), Univ Groningen, Energy & Sustainabil Res Inst Groningen, Integrated Res Energy Environm & Soc IREES, NL-9747 AG Groningen, Netherlands.;Cai, BF (corresponding author), Chinese Acad Environm Planning, Ctr Climate & Environm Policy, Beijing 100012, Peoples R China.;Zhou, Y (corresponding author), Guangdong Univ Technol, Inst Environm & Ecol Engn, Key Lab City Cluster Environm Safety & Green Dev, Minist Educ, Guangzhou 510006, Peoples R China.",y.shan@rug.nl; caibf@caep.org.cn; yazhou@gdut.edu.cn; k.hubacek@rug.nl,"Zhou, Ya/GLV-3914-2022; Feng, Kuishuang/Y-2541-2019; Shan, Yuli/ABE-6011-2020; Shan, Yuli/N-7747-2015; Li, Dong/AAS-4493-2020; Hubacek, Klaus/K-3500-2019; Hubacek, Klaus/GVS-6444-2022","Zhou, Ya/0000-0002-1960-8900; Shan, Yuli/0000-0002-5215-8657; Li, Dong/0000-0002-7527-5645; Fang, Shuai/0000-0002-3108-1072; Hubacek, Klaus/0000-0003-2561-6090","National Natural Science Foundation of China [71673107, 71704029]; Humanities and Social Science Foundation of the Ministry of Education of China [16YJCZH162]; Czech Science Foundation under the project VEENEX (GACR) [1617978S]","National Natural Science Foundation of China(National Natural Science Foundation of China (NSFC)); Humanities and Social Science Foundation of the Ministry of Education of China(Ministry of Education, China); Czech Science Foundation under the project VEENEX (GACR)","B.C. was supported by the National Natural Science Foundation of China (71673107), and Y.Z. was supported by the National Natural Science Foundation of China (71704029) and the Humanities and Social Science Foundation of the Ministry of Education of China (16YJCZH162). K.H. was partly supported by the Czech Science Foundation under the project VEENEX (GACR no. 1617978S).",,75,58,60,16,84,ELSEVIER,AMSTERDAM,"RADARWEG 29, 1043 NX AMSTERDAM, NETHERLANDS",2590-3330,2590-3322,,ONE EARTH,One Earth,JAN 22,2021,4,1,,,,,124,134,,10.1016/j.oneear.2020.12.004,http://dx.doi.org/10.1016/j.oneear.2020.12.004,,JAN 2021,11,Green & Sustainable Science & Technology; Environmental Sciences; Environmental Studies,Science Citation Index Expanded (SCI-EXPANDED); Social Science Citation Index (SSCI),Science & Technology - Other Topics; Environmental Sciences & Ecology,RW3TZ,,"hybrid, Green Published",,,2023-06-02,WOS:000646449800016,View Full Record in Web of Science
J,"Supran, G; Oreskes, N",,,,"Supran, Geoffrey; Oreskes, Naomi",,,Rhetoric and frame analysis of ExxonMobil's climate change communications,ONE EARTH,,,English,Article,,,,,,,OP-ED PAGE; FOSSIL-FUEL; MARKETPLACE ADVOCACY; INDUSTRY ACTORS; SOCIAL-PROBLEM; MOBIL-OIL; TOBACCO; POLICY; HISTORY; ENERGY,"This paper investigates how ExxonMobil uses rhetoric and framing to shape public discourse on climate change. We present an algorithmic corpus comparison and machine-learning topic model of 180 ExxonMobil climate change communications, including peer-reviewed publications, internal company documents, and advertorials in The New York Times. We also investigate advertorials using inductive frame analysis. We find that the company has publicly overemphasized some terms and topics while avoiding others. Most notably, they have used rhetoric of climate risk and consumer energy demand to construct a Fossil Fuel Savior (FFS) frame that downplays the reality and seriousness of climate change, normalizes fossil fuel lock-in, and individualizes responsibility. These patterns mimic the tobacco industry's documented strategy of shifting responsibility away from corporations-which knowingly sold a deadly product while denying its harms-and onto consumers. This historical parallel foreshadows the fossil fuel industry's use of demand-as-blame arguments to oppose litigation, regulation, and activism.","[Supran, Geoffrey; Oreskes, Naomi] Harvard Univ, Dept Hist Sci, Cambridge, MA 02138 USA",Harvard University,"Supran, G (corresponding author), Harvard Univ, Dept Hist Sci, Cambridge, MA 02138 USA.",gjsupran@fas.harvard.edu,,"Supran, Geoffrey/0000-0002-3846-1633",Harvard University Faculty Development Funds; Rockefeller Family Fund,Harvard University Faculty Development Funds; Rockefeller Family Fund,"This research was supported by Harvard University Faculty Development Funds and by the Rockefeller Family Fund. The authors thank Stephan Risi (Stanford University), Richard A. Daynard (Northeastern University), and Viktoria Cologna (ETH Zurich) for helpful discussions; Ploy Achakulwisut (Stockholm Environment Institute) for helpful discussions and assistance with intercoder reliability testing; and three anonymous peer reviewers. G.S. dedicates this publication to the life and memory of his father, Lyle David Supran.",,233,57,57,8,29,ELSEVIER,AMSTERDAM,"RADARWEG 29, 1043 NX AMSTERDAM, NETHERLANDS",2590-3330,2590-3322,,ONE EARTH,One Earth,MAY 21,2021,4,5,,,,,696,719,,10.1016/j.oneear.2021.04.014,http://dx.doi.org/10.1016/j.oneear.2021.04.014,,MAY 2021,24,Green & Sustainable Science & Technology; Environmental Sciences; Environmental Studies,Science Citation Index Expanded (SCI-EXPANDED); Social Science Citation Index (SSCI),Science & Technology - Other Topics; Environmental Sciences & Ecology,SI7UH,,hybrid,,,2023-06-02,WOS:000655035700017,View Full Record in Web of Science
J,"Palomo, I; Locatelli, B; Otero, I; Colloff, M; Crouzat, E; Cuni-Sanchez, A; Gomez-Baggethun, E; Gonzalez-Garcia, A; Gret-Regamey, A; Jimenez-Aceituno, A; Martin-Lopez, B; Pascual, U; Zafra-Calvo, N; Bruley, E; Fischborn, M; Metz, R; Lavorel, S",,,,"Palomo, Ignacio; Locatelli, Bruno; Otero, Iago; Colloff, Matthew; Crouzat, Emilie; Cuni-Sanchez, Aida; Gomez-Baggethun, Erik; Gonzalez-Garcia, Alberto; Gret-Regamey, Adrienne; Jimenez-Aceituno, Amanda; Martin-Lopez, Berta; Pascual, Unai; Zafra-Calvo, Noelia; Bruley, Enora; Fischborn, Marie; Metz, Rosmarie; Lavorel, Sandra",,,Assessing nature-based solutions for transformative change,ONE EARTH,,,English,Article,,,,,,,SOCIAL-ECOLOGICAL APPROACH; CLIMATE-CHANGE; LEVERAGE POINTS; ADAPTATION; BIODIVERSITY; GOVERNANCE; PATHWAYS; SYSTEMS; VALUES; CONSERVATION,"Global sustainability targets demand transformative changes. Nature-based solutions (NbS) are gaining traction in science and policy, but their potential for transformative change remains unexplored. We provide a framework to evaluate how NbS contribute to transformative change and apply it to 93 NbS from mountain social-ecological systems (SES). The framework serves to assess what elements may catalyze transformative change, how transformative change occurs, and what its outcomes are. Our results show that NbS are as much people based'' as nature based.'' Most NbS are based on four elements with transformation poten-tial: nature's values, knowledge types, community engagement, and nature management practices. Our results confirm the potential of NbS for transformative change, observed through changes in non-sustainable trajectories of SES. We illustrate the components of our framework through a novel classification of NbS. The framework provides key components for assessing the effectiveness of NbS and allows tracking long-term transformative change processes.","[Palomo, Ignacio; Bruley, Enora; Lavorel, Sandra] CNRS UGA USMB, Lab Ecol Alpine, UMR 5553, CS 40700, F-38058 Grenoble 9, France; [Palomo, Ignacio; Pascual, Unai; Zafra-Calvo, Noelia] Univ Basque Country, Basque Ctr Climate Change, Sci Campus, Bilbao 48940, Spain; [Locatelli, Bruno] Univ Montpellier, Cirad, F-34398 Montpellier, France; [Locatelli, Bruno] Cifor, Lima 15024, Peru; [Otero, Iago] Univ Lausanne, Interdisciplinary Ctr Mt Res, Campus Sion,Chemin Inst 18, CH-1967 Bramois, Switzerland; [Colloff, Matthew] Australian Natl Univ, Fenner Sch Environm & Soc, Canberra, ACT 2601, Australia; [Crouzat, Emilie] Univ Grenoble Alpes, LESSEM, INRAE, F-38402 St Martin Dheres, France; [Cuni-Sanchez, Aida] Univ York, York Inst Trop Ecosyst, Dept Environm & Geog, Wentworth Way, York YO10 5NG, N Yorkshire, England; [Cuni-Sanchez, Aida; Gomez-Baggethun, Erik] Norwegian Univ Life Sci NM BU, Fac Landscape & Soc, Dept Int Environm & Dev Studies Noragric, POB 5003, N-1432 As, Norway; [Gomez-Baggethun, Erik] Norwegian Inst Nat Res NINA, Sognsveien 68, N-0855 Oslo, Norway; [Gonzalez-Garcia, Alberto] Univ Autonoma Madrid, Dept Ecol, Social Ecol Syst Lab, Edificio Biol,C Darwin 2, Madrid 28049, Spain; [Gret-Regamey, Adrienne] Swiss Fed Inst Technol, Planning Landscape & Urban Syst, Stefano Franscini Pl 5, CH-8093 Zurich, Switzerland; [Jimenez-Aceituno, Amanda] Stockholm Univ, Stockholm Resilience Ctr, S-10691 Stockholm, Sweden; [Martin-Lopez, Berta] Leuphana Univ, Fac Sustainabil, Social Ecol Syst Inst 5E51, D-21335 Luneburg, Germany; [Pascual, Unai] Ikerbasque Basque Fdn Sci, Plaza Euskadi 5, Bilbao 48009, Spain; [Pascual, Unai] Univ Bern, Ctr Dev & Environm, CH-3012 Bern, Switzerland; [Fischborn, Marie] IUCN, Global Protected Areas Programme, CH-1196 Gland, Switzerland; [Metz, Rosmarie] GIZ, Div Climate Change Rural Dev Infrastruct, D-53113 Bonn, Germany",UDICE-French Research Universities; Communaute Universite Grenoble Alpes; Universite Grenoble Alpes (UGA); Centre National de la Recherche Scientifique (CNRS); Universite de Savoie; Basque Centre for Climate Change (BC3); University of Basque Country; CIRAD; Universite de Montpellier; CGIAR; Center for International Forestry Research (CIFOR); University of Lausanne; Australian National University; Communaute Universite Grenoble Alpes; UDICE-French Research Universities; Universite Grenoble Alpes (UGA); INRAE; N8 Research Partnership; White Rose University Consortium; University of York - UK; Norwegian University of Life Sciences; Norwegian Institute Nature Research; Autonomous University of Madrid; Swiss Federal Institutes of Technology Domain; ETH Zurich; Stockholm University; Leuphana University Luneburg; Basque Foundation for Science; University of Bern,"Palomo, I (corresponding author), CNRS UGA USMB, Lab Ecol Alpine, UMR 5553, CS 40700, F-38058 Grenoble 9, France.;Palomo, I (corresponding author), Univ Basque Country, Basque Ctr Climate Change, Sci Campus, Bilbao 48940, Spain.",ignacio.palomo@univ-grenoble-alpes.fr,"PASCUAL, UNAI/B-4766-2012; Locatelli, Bruno/C-9957-2009; PALOMO, IGNACIO/D-4398-2014; Martin-Lopez, Berta/R-9397-2017; Grêt-Regamey, Adrienne/HPE-6858-2023; Grêt-Regamey, Adrienne/AAZ-7546-2021","PASCUAL, UNAI/0000-0002-5696-236X; Locatelli, Bruno/0000-0003-2983-1644; PALOMO, IGNACIO/0000-0002-4573-5989; Martin-Lopez, Berta/0000-0003-2622-0135; Grêt-Regamey, Adrienne/0000-0001-8156-9503; Grêt-Regamey, Adrienne/0000-0001-8156-9503; Gonzalez-Garcia, Alberto/0000-0002-1969-3818; Jimenez Aceituno, Amanda/0000-0002-5950-4751","Mountain Research Initiative Synthesis Workshops - TRANSMOUNT project; French National Research Agency's Programme d'Investissements d'Avenir - Make Our Planet Great Again [ANR-19-MPGA-0009]; MtnPaths - Pathways for global change adaptation of mountain socio-ecological systems, Swiss National Science Foundation [20521L_169916]","Mountain Research Initiative Synthesis Workshops - TRANSMOUNT project; French National Research Agency's Programme d'Investissements d'Avenir - Make Our Planet Great Again(French National Research Agency (ANR)); MtnPaths - Pathways for global change adaptation of mountain socio-ecological systems, Swiss National Science Foundation","We thank the PANORAMA initiative and the solution providers for the data provided, as well as three anonymous reviewers for insightful comments on a previous version of this article. Funding was provided by the Mountain Research Initiative Synthesis Workshops - TRANSMOUNT project, the French National Research Agency's Programme d'Investissements d'Avenir - Make Our Planet Great Again (grant no. ANR-19-MPGA-0009), and MtnPaths - Pathways for global change adaptation of mountain socio-ecological systems, Swiss National Science Foundation grant no. 20521L_169916.",,88,30,31,10,38,ELSEVIER,AMSTERDAM,"RADARWEG 29, 1043 NX AMSTERDAM, NETHERLANDS",2590-3330,2590-3322,,ONE EARTH,One Earth,MAY 21,2021,4,5,,,,,730,741,,10.1016/j.oneear.2021.04.013,http://dx.doi.org/10.1016/j.oneear.2021.04.013,,MAY 2021,12,Green & Sustainable Science & Technology; Environmental Sciences; Environmental Studies,Science Citation Index Expanded (SCI-EXPANDED); Social Science Citation Index (SSCI),Science & Technology - Other Topics; Environmental Sciences & Ecology,SI7UH,,"Green Submitted, Green Published, Green Accepted, Bronze",,,2023-06-02,WOS:000655035700019,View Full Record in Web of Science
