J,"Grant, N; Hawkes, A; Napp, T; Gambhir, A",,,,"Grant, Neil; Hawkes, Adam; Napp, Tamaryn; Gambhir, Ajay",,,Cost reductions in renewables can substantially erode the value of carbon capture and storage in mitigation pathways,ONE EARTH,,,English,Article,,,,,,,INTEGRATED ASSESSMENT MODELS; ENERGY SYSTEM; DEEP DECARBONIZATION; CCS DEPLOYMENT; POWER; ELECTRICITY; TECHNOLOGY; EMISSIONS; SCENARIO; WIND,"Tackling climate change requires a rapid transition to net-zero energy systems. A variety of different technologies could contribute to this transition, and uncertainty remains over their relative role and value. A growing school of thought argues that rapid cost reductions in renewables reduce the need for carbon capture and storage (CCS) in mitigation pathways. Here we use an integrated assessment model to explore how the value of CCS is affected by cost reductions in solar photovoltaics, onshore, and offshore wind. Low-cost renewables could erode the value of CCS by 15%-96% across different energy sectors. Renewables directly compete with CCS, accelerate power sector decarbonization, and enable greater electrification of end-use sectors. CCS has greatest value and resilience to low-cost renewables in sustainable bioenergy/industrial applications, with limited value in hydrogen/electricity generation. This suggests that targeted, rather than blanket, CCS deployment represents the best strategy for achieving the Paris Agreement goals.","[Grant, Neil; Napp, Tamaryn; Gambhir, Ajay] Imperial Coll London, Grantham Inst Climate Change & Environm, London SW7 2AZ, England; [Hawkes, Adam] Imperial Coll London, Dept Chem Engn, London SW7 2AZ, England",Imperial College London; Imperial College London,"Grant, N (corresponding author), Imperial Coll London, Grantham Inst Climate Change & Environm, London SW7 2AZ, England.",n.grant18@imperial.ac.uk,"Hawkes, Adam/F-6631-2012","Hawkes, Adam/0000-0001-9720-332X; Grant, Neil/0000-0001-8671-5012; Gambhir, Ajay/0000-0002-5079-4537",Science and Solutions for a Changing Planet Doctoral Training Programme (SSCP DTP) by the Natural Environment Research Council (NERC); Grantham Institute; H2020 European Commission Project PARIS REINFORCE [820846],Science and Solutions for a Changing Planet Doctoral Training Programme (SSCP DTP) by the Natural Environment Research Council (NERC)(UK Research & Innovation (UKRI)Natural Environment Research Council (NERC)); Grantham Institute; H2020 European Commission Project PARIS REINFORCE,"N.G. would like to thank the Science and Solutions for a Changing Planet Doctoral Training Programme (SSCP DTP) by the Natural Environment Research Council (NERC) and the Grantham Institute for supporting their PhD research. A.G. and A.H. acknowledge support from the H2020 European Commission Project PARIS REINFORCE (grant no. 820846) . AUTHOR CONTRIBUTIONS N.G. developed the initial research hypothesis and experimental design, per-formed the modeling, produced the figures, and wrote the manuscript. A.G. contributed to the research hypothesis and experimental design and sup-ported in writing the manuscript. A.H and T.N. provided advice on experi-mental design and research direction and reviewed and revised the manuscript. The authors declare no competing interests.",,144,9,9,5,19,ELSEVIER,AMSTERDAM,"RADARWEG 29, 1043 NX AMSTERDAM, NETHERLANDS",2590-3330,2590-3322,,ONE EARTH,One Earth,NOV 19,2021,4,11,,,,,1588,1601,,10.1016/j.oneear.2021.10.024,http://dx.doi.org/10.1016/j.oneear.2021.10.024,,NOV 2021,15,Green & Sustainable Science & Technology; Environmental Sciences; Environmental Studies,Science Citation Index Expanded (SCI-EXPANDED); Social Science Citation Index (SSCI),Science & Technology - Other Topics; Environmental Sciences & Ecology,XO5MF,,Green Submitted,,,2023-06-02,WOS:000730228700016,View Full Record in Web of Science
J,"Wang, RR; Assenova, VA; Hertwich, EG",,,,"Wang, Ranran; Assenova, Valentina A.; Hertwich, Edgar G.",,,Energy system decarbonization and productivity gains reduced the coupling of CO2 emissions and economic growth in 73 countries between 1970 and 2016,ONE EARTH,,,English,Article,,,,,,,CARBON-DIOXIDE EMISSIONS; ENVIRONMENTAL KUZNETS CURVE; WORLD; TEMPERATURE; POLLUTION; STIRPAT; IMPACT; PATH; BAD,"Nations must curtail carbon dioxide (CO2) emissions by 7% per annum to meet the Paris Agreement temperature targets. A perceived economic growth-climate mitigation trade-off has diminished political will to act. However, there is no scholarly consensus regarding the magnitude of the trade-off between economic growth and CO2 mitigation and a lack of ex post evidence regarding the extent to which mitigation measures can effectively lower CO2 emissions. Here, we present a structural equation model integrating emissions and economic and energy system characteristics over the period 1970-2016 to empirically assess mechanisms that influence the GDP-CO2 relationship for 73 countries. Robust to various model specifications and statistical tests, we found a simple unitary scale effect between per capita GDP and per capita CO2 emissions, while five emission-reduction mechanisms, principally energy system decarbonization and productivity gains, collectively contributed to global emission reductions by 19 petagrams. Within the observed yearto-year emissions development, reductions at a rate consistent with the Paris Agreement can be achieved in about 10% of instances while maintaining economic growth.","[Wang, Ranran] Leiden Univ, Inst Environm Sci CML, Fac Sci, NL-2333 Leiden, Netherlands; [Wang, Ranran] Univ Twente, Fac Engn Technol, Drienerlolaan 5, NL-7522 Enschede, Netherlands; [Wang, Ranran; Hertwich, Edgar G.] Yale Sch Environm, 195 Prospect St, New Haven, CT 06511 USA; [Assenova, Valentina A.] Univ Penn, Wharton Sch, Management Dept, Philadelphia, PA 19104 USA; [Hertwich, Edgar G.] Norwegian Univ Sci & Technol, Dept Energy & Proc Engn, Kolbjorn Hejes V 1B, N-7491 Trondheim, Norway",Leiden University; Leiden University - Excl LUMC; University of Pennsylvania; Norwegian University of Science & Technology (NTNU),"Hertwich, EG (corresponding author), Yale Sch Environm, 195 Prospect St, New Haven, CT 06511 USA.;Hertwich, EG (corresponding author), Norwegian Univ Sci & Technol, Dept Energy & Proc Engn, Kolbjorn Hejes V 1B, N-7491 Trondheim, Norway.",edgar.hertwich@ntnu.no,,"Hertwich, Edgar/0000-0002-4934-3421; Wang, Ranran/0000-0001-7786-3179; /0000-0002-5637-8139",Yale University; Research Council of Norway (FME NTRANS-Grant) [296205],Yale University; Research Council of Norway (FME NTRANS-Grant)(Research Council of Norway),The authors acknowledge early input by Matthew Kotchen and David I. Stern. R.W. received funding from Yale University. E.G.H. received funding from the Research Council of Norway (FME NTRANS-Grant 296205).,,70,9,10,7,27,ELSEVIER,AMSTERDAM,"RADARWEG 29, 1043 NX AMSTERDAM, NETHERLANDS",2590-3330,2590-3322,,ONE EARTH,One Earth,NOV 19,2021,4,11,,,,,1614,1624,,10.1016/j.oneear.2021.10.010,http://dx.doi.org/10.1016/j.oneear.2021.10.010,,NOV 2021,12,Green & Sustainable Science & Technology; Environmental Sciences; Environmental Studies,Science Citation Index Expanded (SCI-EXPANDED); Social Science Citation Index (SSCI),Science & Technology - Other Topics; Environmental Sciences & Ecology,XO5MF,,"Green Published, hybrid",,,2023-06-02,WOS:000730228700018,View Full Record in Web of Science
J,"Xu, MY; Zhou, HH; Zou, RS; Yang, XY; Su, YY; Angelidaki, I; Zhang, YF",,,,"Xu, Mingyi; Zhou, Huihui; Zou, Rusen; Yang, Xiaoyong; Su, Yanyan; Angelidaki, Irini; Zhang, Yifeng",,,Beyond the farm: Making edible protein from CO2 via hybrid bioinorganic electrosynthesis,ONE EARTH,,,English,Article,,,,,,,BENSON-BASSHAM CYCLE; SINGLE-CELL PROTEIN; OF-THE-ART; CARBON-DIOXIDE; NATURAL-GAS; BIOELECTROCHEMICAL SYSTEMS; MICROBIAL ELECTROSYNTHESIS; ELECTRON-TRANSFER; WASTE-WATER; NITROGEN,"Climate change and food shortage are two of the defining challenges in the coming decades. Considering that conventional approaches for protein production may associate with negative environmental impacts and greenhouse gas emissions, alternative protein sources that rely on inexhaustible substrates/energy should be pursued. In this proof-of-concept study, we propose a two-stage bioinorganic electrosynthesis process that can first convert CO2 and excessive electricity into methane and then synthesize single-cell protein. With an external voltage of 3.5 V and a CO2 inflow rate of 50 mL.d(-1), it was possible to produce methanotrophic biomass of 118.7 +/- 9.2 mg.L-1 with an amino acids mass content of 54.6% +/- 8.3%, resulting in nitrogen assimilation and CO2 conversion efficiency of 91.0% +/- 1.3% and 71.0%. The applied voltages, CO2 inflow rates, and O-2 supply were found to affect the process significantly. This process using renewable feedstocks was proved independent of conventional agriculture for protein production.","[Xu, Mingyi; Zhou, Huihui; Zou, Rusen; Yang, Xiaoyong; Angelidaki, Irini; Zhang, Yifeng] Tech Univ Denmark, Dept Environm Engn, DK-2800 Lyngby, Denmark; [Zhou, Huihui] Harbin Inst Technol, Sch Environm, State Key Lab Urban Water Resources & Environm, Harbin 150090, Peoples R China; [Su, Yanyan] Carlsberg Res Lab, Bjerregaardsvej 5, DK-2500 Valby, Denmark",Technical University of Denmark; Harbin Institute of Technology,"Zhang, YF (corresponding author), Tech Univ Denmark, Dept Environm Engn, DK-2800 Lyngby, Denmark.",yifz@env.dtu.dk,"Xu, Mingyi/GPP-3219-2022; Yang, Xiaoyong/GWZ-1634-2022; Angelidaki, Irini/AAX-2562-2020; Zhang, Yifeng/D-9604-2011; Yang, Xiaoyong/AAP-5403-2021","Yang, Xiaoyong/0000-0003-4231-5062; Angelidaki, Irini/0000-0002-6357-578X; Zhang, Yifeng/0000-0002-2832-2277; Su, Yanyan/0000-0001-9676-7668; Xu, Mingyi/0000-0001-7649-4359",Novo Nordisk Foundation (Denmark) [NNF16OC0021568]; Carlsberg Foundation Distinguished Fellowships (Denmark) [CF18-0084]; China Scholarship Council (China); Otto Monsted Fond (Denmark),Novo Nordisk Foundation (Denmark)(Novo Nordisk Foundation); Carlsberg Foundation Distinguished Fellowships (Denmark); China Scholarship Council (China)(China Scholarship Council); Otto Monsted Fond (Denmark),"This work was supported by the Novo Nordisk Foundation (NNF16OC0021568, Denmark) and the Carlsberg Foundation Distinguished Fellowships (CF18-0084, Denmark). The authors would like to acknowledge the financial support from the China Scholarship Council (China) and the Otto Monsted Fond (Denmark). The authors would like to thank Hector Gracia, Sinh Hy Nguyen, Mikael Emil Olsson, and Dan Zhao for the experimental assistance.",,68,9,9,9,50,ELSEVIER,AMSTERDAM,"RADARWEG 29, 1043 NX AMSTERDAM, NETHERLANDS",2590-3330,2590-3322,,ONE EARTH,One Earth,JUN 18,2021,4,6,,,,,868,878,,10.1016/j.oneear.2021.05.007,http://dx.doi.org/10.1016/j.oneear.2021.05.007,,JUN 2021,11,Green & Sustainable Science & Technology; Environmental Sciences; Environmental Studies,Science Citation Index Expanded (SCI-EXPANDED); Social Science Citation Index (SSCI),Science & Technology - Other Topics; Environmental Sciences & Ecology,SV0WQ,,"Green Submitted, Bronze",,,2023-06-02,WOS:000663548100016,View Full Record in Web of Science
J,"Herbert, ER; Windham-Myers, L; Kirwan, ML",,,,"Herbert, Ellen R.; Windham-Myers, Lisamarie; Kirwan, Matthew L.",,,Sea-level rise enhances carbon accumulation in United States tidal wetlands,ONE EARTH,,,English,Article,,,,,,,MARSH EDGE EROSION; SALT-MARSH; ORGANIC-CARBON; TEMPERATURE SENSITIVITY; COASTAL WETLANDS; RATES; SEQUESTRATION; STORAGE; MODEL; STABILITY,"Coastal wetlands accumulate soil carbon more efficiently than terrestrial systems, but sea-level rise potentially threatens the persistence of this prominent carbon sink. Here, we combine a published dataset of 372 soil carbon accumulation rates from across the United States with new analysis of 131 sites in coastal Louisiana and find that the rate of relative sea-level rise (RSLR) explains 80% of regional variation in carbon accumulation. A carbon mass balance for the rapidly submerging Louisiana coast demonstrates that carbon accumulation rates in surviving marshes increase with RSLR and currently exceed the rate of carbon loss due to marsh drowning and erosion. Although continued erosion will eventually lead to net carbon loss, our results suggest a strong negative carbon-climate feedback for coastal marshes, where even submerging marshes sequester carbon at rates that increase with RSLR.","[Herbert, Ellen R.; Kirwan, Matthew L.] Virginia Inst Marine Sci, Coll William & Mary, Gloucester Point, VA 23062 USA; [Windham-Myers, Lisamarie] US Geol Survey, Water Mission Area, Menlo Pk, CA 94025 USA",William & Mary; Virginia Institute of Marine Science; United States Department of the Interior; United States Geological Survey,"Kirwan, ML (corresponding author), Virginia Inst Marine Sci, Coll William & Mary, Gloucester Point, VA 23062 USA.",kirwan@vims.edu,"Kirwan, Matthew L/F-1806-2011",,Defense Coastal/Estuarine Research Program - Strategic Environmental Research and Development Program; National Science Foundation LTER program; National Science Foundation CAREER program; DOE Terrestrial Ecosystem Science Program; NOAA Hollings Fellowship; Commission for Environmental Cooperation; NASA Carbon Monitoring System [NNH14AY67]; US Geological Survey LandCarbon,Defense Coastal/Estuarine Research Program - Strategic Environmental Research and Development Program; National Science Foundation LTER program(National Science Foundation (NSF)); National Science Foundation CAREER program(National Science Foundation (NSF)); DOE Terrestrial Ecosystem Science Program(United States Department of Energy (DOE)); NOAA Hollings Fellowship; Commission for Environmental Cooperation; NASA Carbon Monitoring System; US Geological Survey LandCarbon(United States Geological Survey),"The authors thank Mark Bessen and David Nicks for initial data compilation, Krista Jankowski and Tor Tornqvist for sharing RSLR information for coastal Louisiana, and Tyler Messerschmidt for help preparing figures. Conversations with Denise Reed and Gregg Snedden improved the work. We also thank Camille LaFosse Stagg (USGS) and two anonymous reviewers for insightful suggestions that improved the manuscript. This work was a collaborative effort supported by the Defense Coastal/Estuarine Research Program, funded by the Strategic Environmental Research and Development Program (E.R.H. and M.L.K.), National Science Foundation LTER and CAREER programs (M.L.K.), DOE Terrestrial Ecosystem Science Program (E.R.H. and M.L.K.), NOAA Hollings Fellowship, Commission for Environmental Cooperation, NASA Carbon Monitoring System (no. NNH14AY67), and US Geological Survey LandCarbon (L.W.-M.). Views, opinions, and/or findings contained in this report are those of the authors and should not be construed as an official US Department of Defense position or decision unless so designated by other official documentation. Any use of trade, firm, or product names is for descriptive purposes only and does not imply endorsement by the US government. This is contribution no. 3933 of the Virginia Institute of Marine Science, William & Mary.",,60,9,9,8,34,ELSEVIER,AMSTERDAM,"RADARWEG 29, 1043 NX AMSTERDAM, NETHERLANDS",2590-3330,2590-3322,,ONE EARTH,One Earth,MAR 19,2021,4,3,,,,,425,433,,10.1016/j.oneear.2021.02.011,http://dx.doi.org/10.1016/j.oneear.2021.02.011,,MAR 2021,9,Green & Sustainable Science & Technology; Environmental Sciences; Environmental Studies,Science Citation Index Expanded (SCI-EXPANDED); Social Science Citation Index (SSCI),Science & Technology - Other Topics; Environmental Sciences & Ecology,RW4BM,,Bronze,,,2023-06-02,WOS:000646469700016,View Full Record in Web of Science
J,"Chen, YP; Lara, MJ; Jones, BM; Frost, GV; Hu, FS",,,,"Chen, Yaping; Lara, Mark J.; Jones, Benjamin M.; Frost, Gerald, V; Hu, Feng Sheng",,,Thermokarst acceleration in Arctic tundra driven by climate change and fire disturbance,ONE EARTH,,,English,Article,,,,,,,ICE-WEDGE DEGRADATION; PERMAFROST DEGRADATION; WARMING PERMAFROST; GROUND ICE; CARBON; FRAGMENTATION; VULNERABILITY; VARIABILITY; ECOSYSTEMS; SEVERITY,"Climate warming is projected to intensify tundra wildfire, with profound implications for permafrost thaw. A major uncertainty is how increased burning will interact with climate change to exacerbate thermokarst (ground-surface collapse resulting from permafrost thaw). Here we show that thermokarst rates increased by similar to 60% with warming climate and wildfire from 1950 to 2015 in Arctic Alaska. Wildfire amplified thermokarst over 40+ years, cumulatively creating similar to 9 times thermokarst formation as that in unburned tundra. However, thermokarst triggered by repeat bums did not differ from that triggered by single burns, irrespective of time between fires. Our simulation identified climate change as the principal driver of all thermokarst formed during 1950-2015 (4,700 km(2)) in Arctic Alaska, but wildfire was disproportionately responsible for 10.5% of the thermokarst by burning merely 3.4% of the landscape. These results combined suggest that climate change and wildfire will synergistically accelerate thermokarst as the Arctic transitions in this century.","[Chen, Yaping; Lara, Mark J.; Hu, Feng Sheng] Univ Illinois, Dept Plant Biol, Urbana, IL 61801 USA; [Chen, Yaping] Coll William & Mary, Virginia Inst Marine Sci, Gloucester Point, VA 23062 USA; [Lara, Mark J.] Univ Illinois, Dept Geog, Urbana, IL 61801 USA; [Jones, Benjamin M.] Univ Alaska Fairbanks, Water & Environm Res Ctr, Inst Northern Engn, Fairbanks, AK 99775 USA; [Frost, Gerald, V] Alaska Biol Res Inc, POB 80410, Fairbanks, AK 99708 USA; [Hu, Feng Sheng] Univ Illinois, Dept Geol, Urbana, IL 61801 USA; [Hu, Feng Sheng] Washington Univ, Dept Biol, St Louis, MO 63130 USA; [Hu, Feng Sheng] Washington Univ, Dept Earth & Planetary Sci, St Louis, MO 63130 USA",University of Illinois System; University of Illinois Urbana-Champaign; William & Mary; Virginia Institute of Marine Science; University of Illinois System; University of Illinois Urbana-Champaign; University of Alaska System; University of Alaska Fairbanks; University of Illinois System; University of Illinois Urbana-Champaign; Washington University (WUSTL); Washington University (WUSTL),"Chen, YP; Lara, MJ; Hu, FS (corresponding author), Univ Illinois, Dept Plant Biol, Urbana, IL 61801 USA.;Chen, YP (corresponding author), Coll William & Mary, Virginia Inst Marine Sci, Gloucester Point, VA 23062 USA.;Lara, MJ (corresponding author), Univ Illinois, Dept Geog, Urbana, IL 61801 USA.;Hu, FS (corresponding author), Univ Illinois, Dept Geol, Urbana, IL 61801 USA.;Hu, FS (corresponding author), Washington Univ, Dept Biol, St Louis, MO 63130 USA.;Hu, FS (corresponding author), Washington Univ, Dept Earth & Planetary Sci, St Louis, MO 63130 USA.",ychen@vims.edu; mjlara@illinois.edu; fshu@wustl.edu,"Lara, Mark J./I-6049-2019; Hu, Feng/IAN-4009-2023","Lara, Mark J./0000-0002-4670-7031; Frost, Gerald/0000-0002-5134-0334; Chen, Yaping/0000-0003-1372-8861","NSF [1023477, 1636476, 1928048]; Polar Geospatial Center under NSF PLR awards [1043681, 1559691]; Direct For Biological Sciences; Division Of Environmental Biology [1636476] Funding Source: National Science Foundation; Div Of Chem, Bioeng, Env, & Transp Sys; Directorate For Engineering [1928048] Funding Source: National Science Foundation","NSF(National Science Foundation (NSF)); Polar Geospatial Center under NSF PLR awards; Direct For Biological Sciences; Division Of Environmental Biology(National Science Foundation (NSF)NSF - Directorate for Biological Sciences (BIO)); Div Of Chem, Bioeng, Env, & Transp Sys; Directorate For Engineering(National Science Foundation (NSF)NSF - Directorate for Engineering (ENG))","Funding for this research was provided by the NSF (1023477 and 1636476 to F.S.H and 1928048 to M.J.L) . We are grateful for the geospatial support provided for this work by the Polar Geospatial Center under NSF PLR awards 1043681 and 1559691. Any use of trade, firm, or product names is for descriptive purposes only and does not imply endorsement by the US Government.",,80,8,8,3,19,ELSEVIER,AMSTERDAM,"RADARWEG 29, 1043 NX AMSTERDAM, NETHERLANDS",2590-3330,2590-3322,,ONE EARTH,One Earth,DEC 17,2021,4,12,,,,,1718,1729,,10.1016/j.oneear.2021.11.011,http://dx.doi.org/10.1016/j.oneear.2021.11.011,,DEC 2021,13,Green & Sustainable Science & Technology; Environmental Sciences; Environmental Studies,Science Citation Index Expanded (SCI-EXPANDED); Social Science Citation Index (SSCI),Science & Technology - Other Topics; Environmental Sciences & Ecology,XU3VM,,,,,2023-06-02,WOS:000734196900014,View Full Record in Web of Science
J,"Zhang, WX; Yun, X; Meng, WJ; Xu, HR; Zhong, QR; Yu, XY; Ren, Y; Shen, HZ; Chen, YL; Shen, GF; Ma, JM; Cheng, HF; Li, BG; Liu, JF; Wang, XJ; Tao, S",,,,"Zhang, Wenxiao; Yun, Xiao; Meng, Wenjun; Xu, Haoran; Zhong, Qirui; Yu, Xinyuan; Ren, Yu'ang; Shen, Huizhong; Chen, Yilin; Shen, Guofeng; Ma, Jianmin; Cheng, Hefa; Li, Bengang; Liu, Junfeng; Wang, Xuejun; Tao, Shu",,,Urban residential energy switching in China between 1980 and 2014 prevents 2.2 million premature deaths,ONE EARTH,,,English,Article,,,,,,,HOUSEHOLD AIR-POLLUTION; CARBON EMISSIONS; ECONOMIC-GROWTH; HEALTH IMPACTS; GLOBAL BURDEN; CONSUMPTION; COAL; PM2.5; COMBUSTION; TRANSITION,"Exposure to air pollution by burning solid fuels (such as coal) for residential cooking and heating in China has caused significant health impacts in the past. The government has implemented measures to replace coal with relatively clean energy sources (e.g., natural gas). However, the scale and scope of health benefits associated with such energy switching in an urban context, when considering both ambient and indoor air quality, remain unclear. Here we used an atmospheric chemical transport model showing that relatively clean energy use increased from 2% to 71% from 1980 to 2014, and although annual premature deaths attributed to particulate matter with an aerodynamic diameter less than 2.5 mm (PM2.5) from urban residential sources increased from 136,000 (87,000-194,000) to 202,000 (117,000-302,000) during the same period, this was primarily due to population growth, urbanization, aging, and backgroundmortality rate changes. In the absence of energy switching, there would have been 2.2 million additional premature deaths. The results provide solid evidence on health benefits of energy switching, suggesting further switching to cleaner energy for expanded health-climate co-benefits.","[Zhang, Wenxiao; Yun, Xiao; Meng, Wenjun; Xu, Haoran; Zhong, Qirui; Yu, Xinyuan; Ren, Yu'ang; Shen, Guofeng; Ma, Jianmin; Cheng, Hefa; Li, Bengang; Liu, Junfeng; Wang, Xuejun; Tao, Shu] Peking Univ, Sino French Inst Earth Syst Sci, Coll Urban & Environm Sci, Lab Earth Surface Proc, Beijing 100871, Peoples R China; [Shen, Huizhong; Chen, Yilin; Tao, Shu] Southern Univ Sci & Technol, Sch Environm Sci & Engn, Shenzhen 518055, Peoples R China",Peking University; Southern University of Science & Technology,"Tao, S (corresponding author), Peking Univ, Sino French Inst Earth Syst Sci, Coll Urban & Environm Sci, Lab Earth Surface Proc, Beijing 100871, Peoples R China.;Tao, S (corresponding author), Southern Univ Sci & Technol, Sch Environm Sci & Engn, Shenzhen 518055, Peoples R China.",taos@pku.edu.cn,"Zhong, Qirui/AAD-7460-2022; xu, haodong/IAM-9132-2023; SHEN, Guofeng/F-3163-2015; Shen, Huizhong/E-8152-2017; Cheng, Hefa/A-1193-2007; xu, hao/GWQ-7394-2022; Chen, Yilin/HLW-9992-2023","Zhong, Qirui/0000-0002-1397-6024; SHEN, Guofeng/0000-0002-7731-5399; Shen, Huizhong/0000-0003-1335-8477; Cheng, Hefa/0000-0003-4911-6971; Chen, Yilin/0000-0001-5532-4115; Yun, Xiao/0000-0002-1062-1244; Zhang, Wenxiao/0000-0002-0234-9295","National Natural Science Foundation of China [41991312, 41830641, 41922057, 41821005]; Chinese Academy of Science [2019QZKK0605, XDA23010100]; Undergraduate Student Research Training Program; High-performance Computing Platform of Peking University",National Natural Science Foundation of China(National Natural Science Foundation of China (NSFC)); Chinese Academy of Science(Chinese Academy of Sciences); Undergraduate Student Research Training Program; High-performance Computing Platform of Peking University,"This work is funded by the National Natural Science Foundation of China (grants 41991312, 41830641, 41922057, and 41821005) , Chinese Academy of Science (2019QZKK0605, XDA23010100) , and Undergraduate Student Research Training Program, and supported by the High-performance Computing Platform of Peking University.",,100,8,9,20,100,ELSEVIER,AMSTERDAM,"RADARWEG 29, 1043 NX AMSTERDAM, NETHERLANDS",2590-3330,2590-3322,,ONE EARTH,One Earth,NOV 19,2021,4,11,,,,,1602,1613,,10.1016/j.oneear.2021.10.013,http://dx.doi.org/10.1016/j.oneear.2021.10.013,,NOV 2021,13,Green & Sustainable Science & Technology; Environmental Sciences; Environmental Studies,Science Citation Index Expanded (SCI-EXPANDED); Social Science Citation Index (SSCI),Science & Technology - Other Topics; Environmental Sciences & Ecology,XO5MF,,Bronze,,,2023-06-02,WOS:000730228700017,View Full Record in Web of Science
